<?xml version="1.0" encoding="UTF-8"?>
<!--Sample XML file generated by XMLSpy v2013 sp1 (http://www.altova.com)-->

<flujo idFlujo="1" idVersion="1" nmFlujo="Flujo acta destacada" xsi:noNamespaceSchemaLocation="Flujos.xsd" xmlns:xsi="http://www.w3.org/2001/XMLSchema-instance">
    <inicio numNodo="1" nombreNodo="Solicitado" tipoNodo="Inicio" tiempoNodo="1" tiempoNodoMax="2">
        <siguiente>
            <numNodoSiguiente>2</numNodoSiguiente>
        </siguiente>
        <rol>
            <cveRol>CLI</cveRol>
            <nmRol>Cliente</nmRol>
        </rol>
    </inicio>
    <nodos numNodo="2" nombreNodo="En revisiÃ³n" tipoNodo="Proceso" tiempoNodo="2" tiempoNodoMax="3">
        <siguiente>
            <numNodoSiguiente>3</numNodoSiguiente>
        </siguiente>
        <rol>
            <cveRol>REC</cveRol>
            <nmRol>Recepcion</nmRol>
        </rol>
    </nodos>
    <nodos numNodo="3" nombreNodo="Agendado, listo para firmar y entrega" tipoNodo="Proceso" tiempoNodo="5" tiempoNodoMax="6">
        <siguiente>
            <numNodoSiguiente>4</numNodoSiguiente>
        </siguiente>
        <rol>
            <cveRol>REC</cveRol>
            <nmRol>Recepcion</nmRol>
        </rol>
    </nodos>
    <fin numNodo="4" nombreNodo="Finalizado" tipoNodo="Fin">
        <siguiente>
            <numNodoSiguiente>4</numNodoSiguiente>
        </siguiente>
        <rol>
            <cveRol>REC</cveRol>
            <nmRol>Recepcion</nmRol>
        </rol>
    </fin>
</flujo>
