<?xml version="1.0" encoding="UTF-8"?><!--Sample XML file generated by XMLSpy v2013 sp1 (http://www.altova.com)-->
<flujo idFlujo="3" idVersion="1" nmFlujo="Flujo permiso para salir del pais" xsi:noNamespaceSchemaLocation="Flujos.xsd"    xmlns:xsi="http://www.w3.org/2001/XMLSchema-instance">    
    <inicio numNodo="1" nombreNodo="Solicitado" tipoNodo="Inicio" tiempoNodo="1" tiempoNodoMax="2">        
        <siguiente>            
            <numNodoSiguiente>2</numNodoSiguiente>        
        </siguiente>        
        <rol>            
            <cveRol>CLI</cveRol>            
            <nmRol>Cliente</nmRol>        
        </rol>    
    </inicio>    
    <nodos numNodo="2" nombreNodo="En revision" tipoNodo="Proceso" tiempoNodo="2" tiempoNodoMax="3">        
        <siguiente>            
            <condicion>                
                <comparative>                    
                    <variable1>ValidadoxRecepción</variable1>
                                        
                    <valueinteger>1</valueinteger>                
                </comparative>            
            </condicion>            
            <numNodoSiguiente>2</numNodoSiguiente>        
        </siguiente>        
        <siguiente>            
            <condicion>                
                <comparative>                    
                    <variable1>ValidadoxRecepción</variable1>                    
                    <valueinteger>2</valueinteger>                
                </comparative>            
            </condicion>            
            <numNodoSiguiente>3</numNodoSiguiente>        
        </siguiente>        
        <rol>            
            <cveRol>REC</cveRol>            
            <nmRol>Recepcion</nmRol>        
        </rol>    
    </nodos>    
    <nodos numNodo="3" nombreNodo="Agendado, listo para firmar y entrega" tipoNodo="Proceso" tiempoNodo="1" tiempoNodoMax="2">        
        <siguiente>            
            <numNodoSiguiente>4</numNodoSiguiente>        
        </siguiente>        
        <rol>            
            <cveRol>REC</cveRol>            
            <nmRol>Recepcion</nmRol>        
        </rol>    
    </nodos>    
    <fin numNodo="4" nombreNodo="Finalizado" tipoNodo="Fin">        
        <siguiente>            
            <numNodoSiguiente>4</numNodoSiguiente>        
        </siguiente>        
        <rol>            
            <cveRol>REC</cveRol>            
            <nmRol>Recepcion</nmRol>        
        </rol>    
    </fin>
</flujo>